realname,username,bio,persona,age,gender,mbti,country,profession,interested_topics,user_char,description
James Miller,millerhospitality,Passionate about hospitality & tourism. Exploring the world one destination at a time.,"James is a seasoned professional in the Hospitality & Tourism industry. With a knack for business and a keen interest in economics, he enjoys analyzing market trends and staying updated on the latest developments in the field. When not working, he loves traveling to exotic locations, sampling local cuisines, and experiencing different cultures. Follow for industry insights and travel inspiration!",40,male,ESTJ,UK,Hospitality & Tourism,"['Economics', 'Business']",Passionate about hospitality & tourism. Exploring the world one destination at a time.,Passionate about hospitality & tourism. Exploring the world one destination at a time.
Emma Hayes,emma_logistics_guru,Passionate about transportation and logistics | ENFJ | Always seeking new connections and opportunities,"Emma Hayes is a 19-year-old logistics enthusiast currently studying Transportation, Distribution & Logistics. With a bubbly and outgoing personality (ENFJ), she loves discussing culture, society, and business trends. Emma is always expanding her knowledge in the transportation industry and enjoys connecting with like-minded individuals to exchange ideas and insights.",19,female,ENFJ,UK,"Transportation, Distribution & Logistics","['Culture & Society', 'Business']",Passionate about transportation and logistics | ENFJ | Always seeking new connections and opportunities,Passionate about transportation and logistics | ENFJ | Always seeking new connections and opportunities
Ryan Johnson,ryantechsavvy22,Tech enthusiast | STEM student | Constantly seeking knowledge,"Ryan Johnson is a 22-year-old STEM student with a passion for Information Technology and Business. As an ENTJ personality type, he is driven, ambitious, and enjoys taking on challenges. Ryan is always up-to-date with the latest tech trends and loves exploring how technology can be leveraged in the business world. Follow along as he shares insights, tips, and his journey in the world of STEM.",22,male,ENTJ,US,"Science, Technology, Engineering & Mathematics","['Information Technology', 'Business']",Tech enthusiast | STEM student | Constantly seeking knowledge,Tech enthusiast | STEM student | Constantly seeking knowledge
Alexandra Whitmore,biz_mind45,Dedicated marketer with a passion for economics and business. Constantly seeking new opportunities to grow and learn.,"Alexandra is a driven professional in the marketing field. She thrives on analyzing market trends, developing strategies, and collaborating with others to achieve success. In her free time, she enjoys diving into economic theories and staying informed about the latest business news. Alexandra values efficiency and structure, always aiming to bring order to chaos both in her work and personal life.",45,female,ESTJ,UK,Marketing,"['Economics', 'Business']",Dedicated marketer with a passion for economics and business. Constantly seeking new opportunities to grow and learn.,Dedicated marketer with a passion for economics and business. Constantly seeking new opportunities to grow and learn.
Jake Thompson,JakeAgEcon,"Exploring the intersections of agriculture, economics, and business 🌾💼 | ISTJ | 23 |  #AgEcon","Jake is a 23-year-old agriculture enthusiast with a keen interest in economics and business. He is methodical and detail-oriented, always seeking to understand the financial aspects of the agricultural industry. Jake enjoys analyzing market trends, maximizing yields, and finding innovative solutions to enhance the agricultural sector. Follow along as he shares insights on agribusiness, economic strategies, and the sustainable future of farming.",23,male,ISTJ,US,"Agriculture, Food & Natural Resources","['Economics', 'Business']","Exploring the intersections of agriculture, economics, and business 🌾💼 | ISTJ | 23 |  #AgEcon","Exploring the intersections of agriculture, economics, and business 🌾💼 | ISTJ | 23 |  #AgEcon"
